<?xml version="1.0" encoding="UTF-8"?>

<memo xmlns:xsi="http://www.w3.org/2001/XMLSchema-instance" xsi:noNamespaceSchemaLocation="ex8-6.xsd">
  <body>
    <pub>
      <Title></Title>
      <Author></Author>
      <Date>2020</Date>
    </pub>
    <bookpub>
      <Title></Title>
      <Author></Author>
      <Date>2020</Date>
      <ISBN></ISBN>
      <Publisher></Publisher>
    </bookpub>
  </body>
</memo>
